{
  "schema_version": 1,
  "diagram_type": "architecture",
  "meta": {
    "title": "spec-cli — 命令面 → 会话 → 真源，加 host 面",
    "locale": "zh-CN",
    "quality_profile": "showcase",
    "legend": {
      "mode": "hidden"
    },
    "repository": {
      "url": "https://github.com/shuxueshuxue/spexcode",
      "revision": "250fd0032ef54107b9225665ba2869635c0706bf"
    },
    "note": "主干 cli-surface → sessions → source-of-truth：spex 的写路径是命令面驱动 worktree 会话，会话再向 main 上的 .spec 真源提案。四个区域按归属分：host 面与传输，会话与驻留，spec 真源与读路径，Issue 与文本引用。命令面和折叠框不进任何区域，因为它调用所有区域。边上的数字是子树之间的 import 条数，只画正文讲过的关系，其余写在卡片里。所有数字都在 revision 那一刻的树上重算。"
  },
  "components": [
    {
      "id": "others",
      "type": "external",
      "label": "其余 14 个子节点",
      "sublabel": "doctor · guide · flat · evidence×3 · spec-search …",
      "tag": "3 drift",
      "sources": [
        {
          "path": ".spec/spexcode/spec-cli/spec.md",
          "label": "spec"
        }
      ],
      "pos": [
        60,
        620
      ],
      "size": [
        280,
        60
      ]
    },
    {
      "id": "cli-surface",
      "type": "frontend",
      "label": "cli-surface",
      "sublabel": "spex 命令面 · cli.ts",
      "sources": [
        {
          "path": ".spec/spexcode/spec-cli/cli-surface/spec.md",
          "label": "spec"
        },
        {
          "path": "spec-cli/src/cli.ts",
          "label": "code"
        }
      ],
      "pos": [
        60,
        350
      ],
      "size": [
        190,
        60
      ]
    },
    {
      "id": "sessions",
      "type": "backend",
      "label": "sessions",
      "sublabel": "75 节点 · worktree 会话状态机",
      "tag": "25 drift",
      "sources": [
        {
          "path": ".spec/spexcode/spec-cli/sessions/spec.md",
          "label": "spec"
        },
        {
          "path": "packages/spec-core/src/graph.ts",
          "label": "code"
        }
      ],
      "pos": [
        390,
        340
      ],
      "size": [
        200,
        76
      ]
    },
    {
      "id": "footprint",
      "type": "cloud",
      "label": "footprint",
      "sublabel": "20 节点 · 驻留到被治理仓库",
      "tag": "2 drift",
      "sources": [
        {
          "path": ".spec/spexcode/spec-cli/footprint/spec.md",
          "label": "spec"
        }
      ],
      "pos": [
        390,
        500
      ],
      "size": [
        200,
        60
      ]
    },
    {
      "id": "source-of-truth",
      "type": "database",
      "label": "source-of-truth",
      "sublabel": "27 节点 · main 的 .spec 为真源",
      "tag": "6 drift",
      "sources": [
        {
          "path": ".spec/spexcode/spec-cli/source-of-truth/spec.md",
          "label": "spec"
        },
        {
          "path": "packages/spec-core/src/specs.ts",
          "label": "code"
        }
      ],
      "pos": [
        720,
        350
      ],
      "size": [
        190,
        60
      ]
    },
    {
      "id": "read-surfaces",
      "type": "frontend",
      "label": "read-surfaces",
      "sublabel": "图 · 树 · 搜索 · 打开节点与源码",
      "pos": [
        1040,
        350
      ],
      "size": [
        190,
        60
      ]
    },
    {
      "id": "serve",
      "type": "cloud",
      "label": "serve",
      "sublabel": "supervisor · gateway · 端口",
      "pos": [
        390,
        60
      ],
      "size": [
        200,
        60
      ]
    },
    {
      "id": "mentions",
      "type": "backend",
      "label": "mentions",
      "sublabel": "[[node]] 与 @session 引用解析",
      "sources": [
        {
          "path": ".spec/spexcode/spec-cli/mentions/spec.md",
          "label": "spec"
        },
        {
          "path": "spec-cli/src/mentions.ts",
          "label": "code"
        }
      ],
      "pos": [
        720,
        500
      ],
      "size": [
        190,
        60
      ]
    },
    {
      "id": "issues",
      "type": "backend",
      "label": "issues",
      "sublabel": "4 节点 · 本地与 forge 统一 Issue",
      "sources": [
        {
          "path": ".spec/spexcode/spec-cli/issues/spec.md",
          "label": "spec"
        },
        {
          "path": "spec-cli/src/issues.ts",
          "label": "code"
        }
      ],
      "pos": [
        1040,
        500
      ],
      "size": [
        190,
        60
      ]
    }
  ],
  "boundaries": [
    {
      "kind": "region",
      "label": "host 面 / 传输",
      "wraps": [
        "serve"
      ]
    },
    {
      "kind": "region",
      "label": "会话与驻留",
      "wraps": [
        "sessions",
        "footprint"
      ]
    },
    {
      "kind": "region",
      "label": "spec 真源与读路径",
      "wraps": [
        "source-of-truth",
        "read-surfaces"
      ]
    },
    {
      "kind": "region",
      "label": "Issue 与文本引用",
      "wraps": [
        "mentions",
        "issues"
      ]
    }
  ],
  "connections": [
    {
      "from": "cli-surface",
      "to": "sessions",
      "label": "22 imports",
      "variant": "emphasis"
    },
    {
      "from": "sessions",
      "to": "source-of-truth",
      "label": "2 imports · 4 back",
      "variant": "emphasis"
    },
    {
      "from": "cli-surface",
      "to": "others",
      "label": "7 imports",
      "fromSide": "left",
      "toSide": "left"
    },
    {
      "from": "cli-surface",
      "to": "footprint",
      "label": "6 imports",
      "fromSide": "right",
      "toSide": "left"
    },
    {
      "from": "cli-surface",
      "to": "serve",
      "label": "2 imports",
      "fromSide": "top",
      "toSide": "left"
    },
    {
      "from": "cli-surface",
      "to": "issues",
      "label": "2 imports",
      "fromSide": "bottom",
      "toSide": "bottom"
    },
    {
      "from": "sessions",
      "to": "footprint",
      "label": "7 imports · 10 back",
      "fromSide": "bottom",
      "toSide": "top",
      "labelDy": 24
    },
    {
      "from": "sessions",
      "to": "mentions",
      "label": "4 imports · 1 back",
      "fromSide": "right",
      "toSide": "left"
    },
    {
      "from": "sessions",
      "to": "serve",
      "label": "3 imports · 3 back",
      "fromSide": "top",
      "toSide": "bottom",
      "labelDx": -60,
      "labelDy": -40
    },
    {
      "from": "read-surfaces",
      "to": "source-of-truth",
      "label": "2 imports"
    },
    {
      "from": "issues",
      "to": "mentions",
      "label": "4 imports · 1 back"
    }
  ],
  "cards": [
    {
      "dot": "cyan",
      "title": "主路径：命令面 → 会话 → 真源",
      "items": [
        "cli-surface → sessions 有 22 条 import，是这一层最粗的边；spex 的写路径就是 CLI 驱动 worktree 会话",
        "sessions 与 source-of-truth 互相 import（2 / 4）、互相提及 28 次：会话是对 main 上 .spec 真源的带署名提案",
        "footprint 与 sessions 双向 17 条 import；它和 source-of-truth 只互相提及 14 次、不 import，图上未画"
      ]
    },
    {
      "dot": "amber",
      "title": "host 面是 serve 的另一张脸",
      "items": [
        "spex serve --public 时 supervisor 的代理退到 loopback，public-mode 的 gateway 接管公网口；默认 serve 不变",
        "占不到公网口就必须响亮地非零退出；serve 与 spex dashboard 共用一个 bind helper（listener-readiness），不是各写一个分支",
        "supervisor 发布带 instanceId 的端点记录，host-gateway 据此对账项目列表；读方先探活再信任"
      ]
    },
    {
      "dot": "rose",
      "title": "折叠与漂移",
      "items": [
        "其余 14 个子节点折进左下角一个框：doctor、guide、guidance-catalog、flat、spec-search、spex-tree、node-attachments、diagram、runtime-repair、worktree-resilience、test-home-isolation、evidence put/get/kind；cli-surface 对它们共 7 条 import",
        "sessions 子树 25 个 drift 是这一层最该有人看的地方；source-of-truth 6、footprint 2、折叠框 3"
      ]
    }
  ]
}
